original_arguments,improved_arguments,graph_id,topic_id,approach,dataset_name,text1,text2
"Today's world is punctuated by new innovations and technologies being released every day. An intriguing one that generates equal interest and consternation across the United States is the technology of self-driving cars. Supporters of self-driving cars note that it would improve fuel efficiency and drive down gasoline costs to consumers, that it would dramatically reduce car-related morbidity and mortality, and that it would allow disabled and elderly individuals independence and the ability to travel freely unlike they could before. However on the opposite side of things, self-driving cars pose new risks and concerns as well. Concerns include their inability to operate in adverse weather conditions, their inability to handle unique road conditions and human traffic signals when mechanical traffic signals aren't present, the high cost associated with the vehicles, and the general wariness that many consumers have for self-driving cars and if the technology would ever even be widely accepted enough for use.

Personally, I find the benefits to self-driving cars vastly outweigh the negative factors. Self-driving cars provide a safe, efficient platform that can reduce motor vehicle accident associated fatalities and injuries significantly, reduce the time of commutes and the cost associated with extended periods of driving, and allows people who aren't able to drive such as the disabled and elderly a newfound freedom that so many who have access to cars take for granted. The large predicted reduction in car accident related injuries and deaths is easily the best supporting reason for self driving cars. It has been reported that up to 81% of motor vehicle accidents are due to human error, and this could be completely mitigated by computers who don't have the capability to be distracted, tired, drunk, or any other factor that reduces a human's ability to drive safely. By taking the human factor out of driving, countless lives and debilitating injuries can be prevented with self-driving cars. Another benefit of self-driving cars is their potential to revolutionize traffic patterns via their ability to ""platoon"" where they drive in coordinated packs together. This coordination allows more cars to be on the road as they can drive closer together in a safer manner than humans can. It also removes the human inefficiency of driving that causes traffic jams and congestion and would therefore reduce commute times and subsequently optimize fuel efficiency to save consumers more money on gasoline. Lastly comes the ability of self-cars to substantially improve the lives of individuals who can't drive such as the elderly and disabled. In a Department of Transportation study, Burkhardt and fellow co-authors found that in elderly woman who stopped driving that they reported increased depressive symptoms, loss of independence, increased financial costs, and increased feelings of isolation. Self-driving cars would be a perfect solution to this, they would return independence to those individuals and reduce the negative factors associated with not being able to drive, therefore improving their quality of life.

Of course however, there are negative factors to self-driving cars that are valid and warrant consideration as well. Opponents to self-driving cars note that the technology just isn't ready yet, self-driving cars still can't handle poor weather conditions such as heavy rain, they cannot accommodate for human traffic signals when regular traffic signals fail, and that there is still a general opposition to the idea of drivers relinquishing control of their cars to a computer which could potentially put them in dangerous situations. However, many of these concerns can be remedied with time and further development. As the technology matures and barriers are hurdled, these risks will be mitigated and self-driving cars can progressively become widely accepted.","In today's era of rapid innovation, self-driving cars have emerged as a polarizing technology in the United States. Proponents argue that it will enhance fuel efficiency, drastically reduce road fatalities, and empower disabled and elderly individuals with unprecedented independence. Conversely, critics highlight concerns such as compromised performance in adverse weather, difficulties with unique road conditions and non-mechanical traffic signals, high vehicle costs, and widespread consumer apprehension.

**Personally, I firmly believe the benefits of self-driving cars far surpass the drawbacks.** Key advantages include:

1. **Enhanced Safety**: Self-driving cars offer a secure platform to significantly decrease motor vehicle accident-related fatalities and injuries, leveraging computers that are immune to distractions, fatigue, and intoxication. With up to 81% of accidents attributed to human error, this technology can prevent countless lives and debilitating injuries.
2. **Efficient Transportation**: By ""platooning"" (driving in coordinated packs), self-driving cars can optimize traffic patterns, increasing road capacity while reducing commute times and fuel consumption, thereby saving consumers money on gasoline.
3. **Empowering the Disabled and Elderly**: Self-driving cars can revolutionize the lives of those unable to drive, restoring independence and mitigating the negative impacts of driving cessation, as evidenced by a Department of Transportation study highlighting increased depressive symptoms, loss of autonomy, financial burdens, and social isolation among elderly non-drivers.

**Acknowledging Valid Concerns:**
While legitimate, the drawbacks of self-driving cars—technological immaturity, poor performance in adverse weather, difficulties with human traffic signals, and consumer resistance—can be addressed through **ongoing development and refinement**. As the technology advances and hurdles are overcome, these risks will diminish, paving the way for widespread acceptance and the realization of self-driving cars' transformative potential.",draft1_2018argrewrite_79.txt,Self-driving cars,direct,revision2,"Today's world is punctuated by new innovations and technologies being released every day. An intriguing one that generates equal interest and consternation across the United States is the technology of self-driving cars. Supporters of self-driving cars note that it would improve fuel efficiency and drive down gasoline costs to consumers, that it would dramatically reduce car-related morbidity and mortality, and that it would allow disabled and elderly individuals independence and the ability to travel freely unlike they could before. However on the opposite side of things, self-driving cars pose new risks and concerns as well. Concerns include their inability to operate in adverse weather conditions, their inability to handle unique road conditions and human traffic signals when mechanical traffic signals aren't present, the high cost associated with the vehicles, and the general wariness that many consumers have for self-driving cars and if the technology would ever even be widely accepted enough for use.

Personally, I find the benefits to self-driving cars vastly outweigh the negative factors. Self-driving cars provide a safe, efficient platform that can reduce motor vehicle accident associated fatalities and injuries significantly, reduce the time of commutes and the cost associated with extended periods of driving, and allows people who aren't able to drive such as the disabled and elderly a newfound freedom that so many who have access to cars take for granted. The large predicted reduction in car accident related injuries and deaths is easily the best supporting reason for self driving cars. It has been reported that up to 81% of motor vehicle accidents are due to human error, and this could be completely mitigated by computers who don't have the capability to be distracted, tired, drunk, or any other factor that reduces a human's ability to drive safely. By taking the human factor out of driving, countless lives and debilitating injuries can be prevented with self-driving cars. Another benefit of self-driving cars is their potential to revolutionize traffic patterns via their ability to ""platoon"" where they drive in coordinated packs together. This coordination allows more cars to be on the road as they can drive closer together in a safer manner than humans can. It also removes the human inefficiency of driving that causes traffic jams and congestion and would therefore reduce commute times and subsequently optimize fuel efficiency to save consumers more money on gasoline. Lastly comes the ability of self-cars to substantially improve the lives of individuals who can't drive such as the elderly and disabled. In a Department of Transportation study, Burkhardt and fellow co-authors found that in elderly woman who stopped driving that they reported increased depressive symptoms, loss of independence, increased financial costs, and increased feelings of isolation. Self-driving cars would be a perfect solution to this, they would return independence to those individuals and reduce the negative factors associated with not being able to drive, therefore improving their quality of life.

Of course however, there are negative factors to self-driving cars that are valid and warrant consideration as well. Opponents to self-driving cars note that the technology just isn't ready yet, self-driving cars still can't handle poor weather conditions such as heavy rain, they cannot accommodate for human traffic signals when regular traffic signals fail, and that there is still a general opposition to the idea of drivers relinquishing control of their cars to a computer which could potentially put them in dangerous situations. However, many of these concerns can be remedied with time and further development. As the technology matures and barriers are hurdled, these risks will be mitigated and self-driving cars can progressively become widely accepted.","In today's era of rapid innovation, self-driving cars have emerged as a polarizing technology in the United States. Proponents argue that it will enhance fuel efficiency, drastically reduce road fatalities, and empower disabled and elderly individuals with unprecedented independence. Conversely, critics highlight concerns such as compromised performance in adverse weather, difficulties with unique road conditions and non-mechanical traffic signals, high vehicle costs, and widespread consumer apprehension.

**Personally, I firmly believe the benefits of self-driving cars far surpass the drawbacks.** Key advantages include:

1. **Enhanced Safety**: Self-driving cars offer a secure platform to significantly decrease motor vehicle accident-related fatalities and injuries, leveraging computers that are immune to distractions, fatigue, and intoxication. With up to 81% of accidents attributed to human error, this technology can prevent countless lives and debilitating injuries.
2. **Efficient Transportation**: By ""platooning"" (driving in coordinated packs), self-driving cars can optimize traffic patterns, increasing road capacity while reducing commute times and fuel consumption, thereby saving consumers money on gasoline.
3. **Empowering the Disabled and Elderly**: Self-driving cars can revolutionize the lives of those unable to drive, restoring independence and mitigating the negative impacts of driving cessation, as evidenced by a Department of Transportation study highlighting increased depressive symptoms, loss of autonomy, financial burdens, and social isolation among elderly non-drivers.

**Acknowledging Valid Concerns:**
While legitimate, the drawbacks of self-driving cars—technological immaturity, poor performance in adverse weather, difficulties with human traffic signals, and consumer resistance—can be addressed through **ongoing development and refinement**. As the technology advances and hurdles are overcome, these risks will diminish, paving the way for widespread acceptance and the realization of self-driving cars' transformative potential."
"The idea of having self-driving cars may have seemed far away into the future until now. Or is it? The first reaction would be to love the new, innovative idea. However, every time technology introduces a revolutionary invention; it is always met with various critical drawbacks. If possible, self-driving cars could lower car accidents and drunk driving with the use of computer algorithms, reduce traffic, and create higher speed limits through computer operations. Nevertheless, this would have worse results. Self-driving cars cannot be implemented in society because of the potential risks and dangers that may occur in the future.

The creation of self-driving cars would cause unemployment in the transportation sector. Not only will taxi drivers, bus drivers, car instructors, workers, and personal injury lawyers lose their jobs, but the gasoline industry and auto manufacturers will suffer the same fate. America cannot afford to risk losing two of the biggest industries that create large amounts of revenue. On top of that, self-driving cars would not be consumer friendly. The average American citizen would not be able to purchase these cars because of the high cost. The engineering, software, sensors, and power/computer requirements itself costs $100,000. However, proponents of the new innovation still say that the solution to cities that have inadequate public transportation is self-driving cars. This is a clear misconception because public transportation would cease to exist and people would not be able to afford the new cars. Ultimately, the adoption of self-driving cars is a bad choice that will negatively affect the workers and the economy.

Another huge risk is security and safety. Implementing computers in cars would bring all the vulnerabilities of the computer with it. Issues regarding identity theft are unavoidable because of the extensive amounts of information that must be stored in computers for the car to operate. Personal data in the software such as bank account information could be stolen by hackers. This issue also brings up a safety hazard because self-driving cars are only suited for the perfect scenario and deemed to technological failures. In bad weather situations such as heavy rain and snow, laser sensors will fail. In addition, self-driving cars would have a hard time driving through hazards, detours, accidents, and on roads of different areas because of the road laws in each state. Although the use of GPS maps has aided a lot of drivers today, there are times where the directions are inaccurate. Since self-driving cars rely on the GPS, there is a possibility in which cars could take dangerous turns off the road.

In a perfect society, self-driving cars can definitely exist. In our world today, America is far from it. Only if there are no flaws and testings come out perfect will there be a serious discussion of overhauling the automobile industry. However, it seems foolish to start this now. Promise and opportunity are not enough to fully adopt self-driving cars.","

The concept of self-driving cars, once considered a distant future innovation, is now a tangible reality. While the initial reaction might be enthusiasm for the novel idea, it's essential to acknowledge the critical drawbacks that often accompany revolutionary technologies. Proponents argue that self-driving cars could utilize computer algorithms to reduce car accidents, drunk driving, and traffic congestion, while potentially increasing speed limits. However, a closer examination reveals that the risks and dangers associated with their implementation outweigh these benefits, making their integration into society inadvisable at this time.

**Economic Concerns and Unemployment**
The introduction of self-driving cars would significantly impact the job market, leading to widespread unemployment in the transportation sector. This would not only affect taxi drivers, bus drivers, car instructors, and personal injury lawyers but also have a ripple effect on the gasoline industry and auto manufacturers, two of America's largest revenue-generating industries. An additional barrier to adoption is the prohibitively high cost of these vehicles, estimated at $100,000 due to the sophisticated engineering, software, sensors, and power/computer requirements. Contrary to the notion that self-driving cars could resolve public transportation inadequacies in cities, their adoption would likely lead to the demise of public transportation systems, further pricing out the average American citizen.

**Security and Safety Risks**
Integrating computers into vehicles inherits all the vulnerabilities of computer systems, including the risk of identity theft due to the extensive personal and financial data (e.g., bank account information) required for operation. This poses a significant safety hazard, as self-driving cars are optimized for ideal scenarios and are susceptible to technological failures. Inclement weather conditions, such as heavy rain or snow, can cripple laser sensors, and navigating through hazards, detours, accidents, and complying with varying road laws across different states poses additional challenges. The reliance on GPS, which can sometimes provide inaccurate directions, further exacerbates the potential for dangerous misroutes.

**Conclusion: Premature Implementation**
While self-driving cars could thrive in a flawless, ideal society, the current world, with its inherent complexities and imperfections, is not yet ready. Any consideration of overhauling the automobile industry should be contingent upon flawless testing and the absence of significant flaws. At present, the promise and potential of self-driving cars are insufficient to justify their full-scale adoption, making it prudent to postpone such a monumental shift. ",draft1_2018argrewrite_102.txt,Self-driving cars,direct,revision2,"The idea of having self-driving cars may have seemed far away into the future until now. Or is it? The first reaction would be to love the new, innovative idea. However, every time technology introduces a revolutionary invention; it is always met with various critical drawbacks. If possible, self-driving cars could lower car accidents and drunk driving with the use of computer algorithms, reduce traffic, and create higher speed limits through computer operations. Nevertheless, this would have worse results. Self-driving cars cannot be implemented in society because of the potential risks and dangers that may occur in the future.

The creation of self-driving cars would cause unemployment in the transportation sector. Not only will taxi drivers, bus drivers, car instructors, workers, and personal injury lawyers lose their jobs, but the gasoline industry and auto manufacturers will suffer the same fate. America cannot afford to risk losing two of the biggest industries that create large amounts of revenue. On top of that, self-driving cars would not be consumer friendly. The average American citizen would not be able to purchase these cars because of the high cost. The engineering, software, sensors, and power/computer requirements itself costs $100,000. However, proponents of the new innovation still say that the solution to cities that have inadequate public transportation is self-driving cars. This is a clear misconception because public transportation would cease to exist and people would not be able to afford the new cars. Ultimately, the adoption of self-driving cars is a bad choice that will negatively affect the workers and the economy.

Another huge risk is security and safety. Implementing computers in cars would bring all the vulnerabilities of the computer with it. Issues regarding identity theft are unavoidable because of the extensive amounts of information that must be stored in computers for the car to operate. Personal data in the software such as bank account information could be stolen by hackers. This issue also brings up a safety hazard because self-driving cars are only suited for the perfect scenario and deemed to technological failures. In bad weather situations such as heavy rain and snow, laser sensors will fail. In addition, self-driving cars would have a hard time driving through hazards, detours, accidents, and on roads of different areas because of the road laws in each state. Although the use of GPS maps has aided a lot of drivers today, there are times where the directions are inaccurate. Since self-driving cars rely on the GPS, there is a possibility in which cars could take dangerous turns off the road.

In a perfect society, self-driving cars can definitely exist. In our world today, America is far from it. Only if there are no flaws and testings come out perfect will there be a serious discussion of overhauling the automobile industry. However, it seems foolish to start this now. Promise and opportunity are not enough to fully adopt self-driving cars.","

The concept of self-driving cars, once considered a distant future innovation, is now a tangible reality. While the initial reaction might be enthusiasm for the novel idea, it's essential to acknowledge the critical drawbacks that often accompany revolutionary technologies. Proponents argue that self-driving cars could utilize computer algorithms to reduce car accidents, drunk driving, and traffic congestion, while potentially increasing speed limits. However, a closer examination reveals that the risks and dangers associated with their implementation outweigh these benefits, making their integration into society inadvisable at this time.

**Economic Concerns and Unemployment**
The introduction of self-driving cars would significantly impact the job market, leading to widespread unemployment in the transportation sector. This would not only affect taxi drivers, bus drivers, car instructors, and personal injury lawyers but also have a ripple effect on the gasoline industry and auto manufacturers, two of America's largest revenue-generating industries. An additional barrier to adoption is the prohibitively high cost of these vehicles, estimated at $100,000 due to the sophisticated engineering, software, sensors, and power/computer requirements. Contrary to the notion that self-driving cars could resolve public transportation inadequacies in cities, their adoption would likely lead to the demise of public transportation systems, further pricing out the average American citizen.

**Security and Safety Risks**
Integrating computers into vehicles inherits all the vulnerabilities of computer systems, including the risk of identity theft due to the extensive personal and financial data (e.g., bank account information) required for operation. This poses a significant safety hazard, as self-driving cars are optimized for ideal scenarios and are susceptible to technological failures. Inclement weather conditions, such as heavy rain or snow, can cripple laser sensors, and navigating through hazards, detours, accidents, and complying with varying road laws across different states poses additional challenges. The reliance on GPS, which can sometimes provide inaccurate directions, further exacerbates the potential for dangerous misroutes.

**Conclusion: Premature Implementation**
While self-driving cars could thrive in a flawless, ideal society, the current world, with its inherent complexities and imperfections, is not yet ready. Any consideration of overhauling the automobile industry should be contingent upon flawless testing and the absence of significant flaws. At present, the promise and potential of self-driving cars are insufficient to justify their full-scale adoption, making it prudent to postpone such a monumental shift. "
