original_arguments,improved_arguments,graph_id,topic_id,approach,dataset_name,text1,text2
"As with the advent and introduction of any new technology, there are pros and cons that arise with the implementation of that technology. This is also true with self-driving cars. With the testing of self-driving cars currently happening in several cities across the country, the debate on whether or not they are safer than cars driven by humans has been highlighted in the media. Many cars already come equipped with some of the basic technology - autonomous breaking, self-parking, or sensors that detect close objects - so we may be closer to the future than we think.

There are several pros for the use of self-driving cars, and one of the biggest is safety. While a small percentage of car accidents could be caused by mechanical failures, the majority are caused by a distracted driver. Computers make for the ideal driver as they will not get tired, lose their eyesight, get distracted, imbibe in drugs or alcohol, etc. Computers also use specific algorithms to calculate speed, stopping distance, and other collected information that help to dramatically decrease the chance of an accident.

In addition to safety, there are many other positive side-effects to autonomous driving. Self-driving cars could help with traffic optimization by communicating with each other to help identify traffic problems. Their specific algorithms and sensors could help to reduce commute times while also allowing more cars on the road with less traffic. People with disabilities would have more options at their disposal. Police could focus less time on traffic stops and more time on other crimes. People would have more time to do other things with less parking and DMV headaches for drivers. The benefits are endless.

With all the good things that come with technology, there are bound to be some bad, as well. One of the biggest downfalls anticipated with self-driving cars would be their affect on the economy. Many benefits rely on more people opting in to the service, yet the cost of the new technology is more expensive than most Americans can afford. It is also expected that most self-driving cars would be electric, further putting a strain on the gas industry. Reliance on technology could make a driver's license, insurance, the DMV, and other driving related vendors obsolete, creating job loss in those areas, as well as the areas of freight and taxi drivers. 

Other downfalls to autonomous cars would be the flaws with technology itself. A computer cannot detect a road block or read human hand signals, so road construction would be an obstacle. The sensors are located on the outside of the vehicle, so severe weather can damage them. Computers attract hackers so there is always a chance for breach of security. Another risk would be the technology failure where a person must take over the controls - what if it is someone that has never driven a car before? What if the GPS fails? What if a sensor malfunctions?

While a completely autonomous driving society is probably a ways off, society certainly seems to be leaning towards it. I do believe that self-driving cars will be a benefit in many ways - safety, inclusion, environment, and time/traffic - and most of the cons are solvable and temporary issues. While there may be jobs that are lost in transportation, there will be jobs that are created with the manufacturing of these vehicles. Technology, security, construction, and bug issues can potentially be solved with better firewalls and later versions of software. This could be an incredibly powerful tool for those that were previously reliant on others to get around, such as the elderly or disabled.","

As the world witnesses the emergence of self-driving cars, a dual-edged narrative unfolds, echoing the introduction of any groundbreaking technology. With ongoing testing in numerous cities, the debate surrounding the safety of autonomous vehicles versus human-driven cars has gained significant media attention. Notably, many modern cars already feature rudimentary autonomous technology, such as autonomous braking, self-parking, and object detection sensors, hinting that a fully autonomous future may be closer than anticipated.

**Safety: The Paramount Advantage**
A compelling argument in favor of self-driving cars is their potential to drastically enhance road safety. Given that the majority of car accidents stem from human error, computers emerge as ideal drivers, impervious to fatigue, visual impairments, distractions, substance influence, and other human frailties. By leveraging precise algorithms to calculate speed, stopping distances, and process collected data, the likelihood of accidents is significantly minimized.

**Far-Reaching Benefits Beyond Safety**
Autonomous driving promises a plethora of additional advantages:
- **Traffic Optimization**: Self-driving cars, through inter-vehicle communication, can identify and mitigate traffic bottlenecks, reducing commute times and increasing road capacity.
- **Enhanced Mobility for the Disabled**: Autonomous vehicles offer unprecedented independence for individuals with disabilities.
- **Law Enforcement Efficiency**: With reduced need for traffic stops, police can focus on more pressing crimes.
- **Increased Productivity and Reduced Hassles**: Commuters can utilize travel time more effectively, and the complexities of parking and DMV processes are diminished for drivers.

**The Anticipated Drawbacks**
Despite the myriad benefits, several challenges are foreseen:
- **Economic Impact**: The high cost of autonomous technology may limit adoption, affecting the gas industry and potentially rendering certain jobs (e.g., driving-related services, freight, and taxi drivers) obsolete.
- **Technological Vulnerabilities**:
  - **Infrastructure Challenges**: Computers may struggle with reading human signals or navigating roadblocks.
  - **Weather Sensitivity**: External sensors are susceptible to severe weather conditions.
  - **Cybersecurity Risks**: The potential for hacking poses a significant threat.
  - **Technology Failure Scenarios**: The reliance on a human takeover in case of failure raises concerns, especially for inexperienced drivers, GPS failures, or sensor malfunctions.

**A Balanced Perspective**
Although a fully autonomous driving society is likely a distant prospect, the trajectory is undoubtedly towards increased autonomy. I firmly believe that the benefits of self-driving cars—in terms of safety, inclusivity, environmental impact, and time/traffic efficiency—will ultimately outweigh the drawbacks. Most of the cons are transient and solvable with advancements in technology, cybersecurity, and infrastructure. While job losses in transportation are anticipated, the manufacturing sector of these vehicles is poised to create new employment opportunities. Ultimately, self-driving cars could revolutionize mobility for the elderly and disabled, offering them unprecedented independence. ",draft1_2018argrewrite_24.txt,Self-driving cars,direct,revision2,"As with the advent and introduction of any new technology, there are pros and cons that arise with the implementation of that technology. This is also true with self-driving cars. With the testing of self-driving cars currently happening in several cities across the country, the debate on whether or not they are safer than cars driven by humans has been highlighted in the media. Many cars already come equipped with some of the basic technology - autonomous breaking, self-parking, or sensors that detect close objects - so we may be closer to the future than we think.

There are several pros for the use of self-driving cars, and one of the biggest is safety. While a small percentage of car accidents could be caused by mechanical failures, the majority are caused by a distracted driver. Computers make for the ideal driver as they will not get tired, lose their eyesight, get distracted, imbibe in drugs or alcohol, etc. Computers also use specific algorithms to calculate speed, stopping distance, and other collected information that help to dramatically decrease the chance of an accident.

In addition to safety, there are many other positive side-effects to autonomous driving. Self-driving cars could help with traffic optimization by communicating with each other to help identify traffic problems. Their specific algorithms and sensors could help to reduce commute times while also allowing more cars on the road with less traffic. People with disabilities would have more options at their disposal. Police could focus less time on traffic stops and more time on other crimes. People would have more time to do other things with less parking and DMV headaches for drivers. The benefits are endless.

With all the good things that come with technology, there are bound to be some bad, as well. One of the biggest downfalls anticipated with self-driving cars would be their affect on the economy. Many benefits rely on more people opting in to the service, yet the cost of the new technology is more expensive than most Americans can afford. It is also expected that most self-driving cars would be electric, further putting a strain on the gas industry. Reliance on technology could make a driver's license, insurance, the DMV, and other driving related vendors obsolete, creating job loss in those areas, as well as the areas of freight and taxi drivers. 

Other downfalls to autonomous cars would be the flaws with technology itself. A computer cannot detect a road block or read human hand signals, so road construction would be an obstacle. The sensors are located on the outside of the vehicle, so severe weather can damage them. Computers attract hackers so there is always a chance for breach of security. Another risk would be the technology failure where a person must take over the controls - what if it is someone that has never driven a car before? What if the GPS fails? What if a sensor malfunctions?

While a completely autonomous driving society is probably a ways off, society certainly seems to be leaning towards it. I do believe that self-driving cars will be a benefit in many ways - safety, inclusion, environment, and time/traffic - and most of the cons are solvable and temporary issues. While there may be jobs that are lost in transportation, there will be jobs that are created with the manufacturing of these vehicles. Technology, security, construction, and bug issues can potentially be solved with better firewalls and later versions of software. This could be an incredibly powerful tool for those that were previously reliant on others to get around, such as the elderly or disabled.","

As the world witnesses the emergence of self-driving cars, a dual-edged narrative unfolds, echoing the introduction of any groundbreaking technology. With ongoing testing in numerous cities, the debate surrounding the safety of autonomous vehicles versus human-driven cars has gained significant media attention. Notably, many modern cars already feature rudimentary autonomous technology, such as autonomous braking, self-parking, and object detection sensors, hinting that a fully autonomous future may be closer than anticipated.

**Safety: The Paramount Advantage**
A compelling argument in favor of self-driving cars is their potential to drastically enhance road safety. Given that the majority of car accidents stem from human error, computers emerge as ideal drivers, impervious to fatigue, visual impairments, distractions, substance influence, and other human frailties. By leveraging precise algorithms to calculate speed, stopping distances, and process collected data, the likelihood of accidents is significantly minimized.

**Far-Reaching Benefits Beyond Safety**
Autonomous driving promises a plethora of additional advantages:
- **Traffic Optimization**: Self-driving cars, through inter-vehicle communication, can identify and mitigate traffic bottlenecks, reducing commute times and increasing road capacity.
- **Enhanced Mobility for the Disabled**: Autonomous vehicles offer unprecedented independence for individuals with disabilities.
- **Law Enforcement Efficiency**: With reduced need for traffic stops, police can focus on more pressing crimes.
- **Increased Productivity and Reduced Hassles**: Commuters can utilize travel time more effectively, and the complexities of parking and DMV processes are diminished for drivers.

**The Anticipated Drawbacks**
Despite the myriad benefits, several challenges are foreseen:
- **Economic Impact**: The high cost of autonomous technology may limit adoption, affecting the gas industry and potentially rendering certain jobs (e.g., driving-related services, freight, and taxi drivers) obsolete.
- **Technological Vulnerabilities**:
  - **Infrastructure Challenges**: Computers may struggle with reading human signals or navigating roadblocks.
  - **Weather Sensitivity**: External sensors are susceptible to severe weather conditions.
  - **Cybersecurity Risks**: The potential for hacking poses a significant threat.
  - **Technology Failure Scenarios**: The reliance on a human takeover in case of failure raises concerns, especially for inexperienced drivers, GPS failures, or sensor malfunctions.

**A Balanced Perspective**
Although a fully autonomous driving society is likely a distant prospect, the trajectory is undoubtedly towards increased autonomy. I firmly believe that the benefits of self-driving cars—in terms of safety, inclusivity, environmental impact, and time/traffic efficiency—will ultimately outweigh the drawbacks. Most of the cons are transient and solvable with advancements in technology, cybersecurity, and infrastructure. While job losses in transportation are anticipated, the manufacturing sector of these vehicles is poised to create new employment opportunities. Ultimately, self-driving cars could revolutionize mobility for the elderly and disabled, offering them unprecedented independence. "
"I am in favor of self automative cars and am planning to be in line to buy one once they are implemented. The main advantage of artificial intelligence is it is not biased and cannot be distracted, thereby eliminating accidents,which are always based on human error,according to all statistics. The fact the machine would observe all speed limits,stop signs,traffic lights, would mean the elimination of some traffic cops,saving millloins of tax dollars. In addition to the possible elimination of traffic police, what is exciting is the possible elimination of car insurance, or at least a reduction of it because of many fewer accidents.Productivity would go up which would boost the economy, as instead of concentrating on driving, one could do work in his car(it could be his home office), or even have a martini or watch his favorite television show.Self driving cars would be an advantage for the environment, for instead of a lazy driver aimlessly looking for a parking space closest to the store so they don't have to walk. the self driving car would drop off a person and drive directly to a parking spot maybe  not within walking distance,thereby saving precious fuel. The person would simply have to wait for the car to pick him up! The car could pick up crippled people in smaller more efficient cars to get them to all those dr's appointments, thereby eliminating all those irritating access buses that litter our sreets.Instead of paying a uneducated truck drver, who can be a danger on the highway, a self driving car could drive all night, never needing a paycheck or food. Consequently, the price of our store purchases would go down. As far as the elimination of jobs,there is nothing to be alarmed about as service jobs are very abundant and the infrastructure of the self driving cars would create many well paying positions.The cost of the self driving cars would be prohibitive for some, however, just like Fords model t, the cars would eventually have to be priced so all could afford it.Electronic technology always goes down in price,as is evidenced by phones,tvs,etc. The most daunting task is to actually get the technology to work full proof - it would be critical to this self driving cars to be a perfection with no flaws what so ever. Also, the maintanience of the satellite infrastructure would be quite costly, and what institution would be responsible for the cost.These tasks will take many decades to sort out. In addition to this aspect, if there is an accident, would the manufacturer,infrastructure,or person in the car be at fault.    It would be difficult to sort this out, but once it was done, we could eliminate those pesky ambulance chasing lawyers,asthere still would less accidents. We are decades away from perfection of these issues,however,there are highly cognitive driven people who could figure all this out, so self driving cars will be the biggest phenomenon of this century.","

I strongly support the adoption of self-driving cars and plan to be among the first in line to purchase one once they're widely available. The primary advantage of these vehicles lies in their reliance on artificial intelligence, which is unbiased and immune to distractions, thereby drastically reducing accidents caused by human error, as supported by all relevant statistics.

The implementation of self-driving cars would have a multifaceted positive impact on society:

* **Enhanced Road Safety**: With machines adhering strictly to speed limits, stop signs, and traffic lights, the need for traffic enforcement could decrease, potentially saving millions of tax dollars.
* **Reduced Insurance Costs**: The significant decrease in accidents would likely lead to a reduction, if not elimination, of car insurance, further benefiting consumers.
* **Boost to Productivity and Economy**: With the ability to work, relax, or entertain oneself during travel, productivity would increase, potentially boosting the economy.
* **Environmental Benefits**: Efficient parking strategies, such as dropping off passengers and then parking in less convenient spots, would save fuel. Additionally, self-driving cars could optimize routes, further reducing emissions.
* **Increased Accessibility**: Smaller, more efficient vehicles could be used for transporting individuals with disabilities to appointments, replacing larger, less efficient access buses.
* **Logistical Advantages**: Autonomous trucks could operate around the clock without the need for driver rest, potentially lowering the cost of goods by reducing labor and operational costs.

Regarding concerns:

* **Job Elimination vs. Creation**: While certain jobs may be lost, the infrastructure and maintenance of self-driving cars would create new, well-paying positions. Service sector jobs are also abundant and could absorb those displaced.
* **Affordability**: Similar to the historical trend with electronic technology (e.g., phones, TVs), the cost of self-driving cars would likely decrease over time, making them more accessible.
* **Technological Challenges and Liability**:
	+ **Perfection of Technology**: Achieving flawless operation is critical and will require significant time and investment.
	+ **Maintenance of Satellite Infrastructure**: The costs, and the entity responsible, pose significant logistical challenges.
	+ **Liability in Accidents**: Determining fault (manufacturer, infrastructure, or passenger) would require new legal frameworks, but could ultimately lead to a reduction in legal disputes and costs associated with accidents.

While resolving these challenges may take decades, the potential benefits of self-driving cars make them poised to be one of the most transformative phenomena of this century, driven forward by innovative solutions from highly skilled professionals. ",draft1_2018argrewrite_18.txt,Self-driving cars,direct,revision2,"

I strongly support the adoption of self-driving cars and plan to be among the first in line to purchase one once they're widely available. The primary advantage of these vehicles lies in their reliance on artificial intelligence, which is unbiased and immune to distractions, thereby drastically reducing accidents caused by human error, as supported by all relevant statistics.

The implementation of self-driving cars would have a multifaceted positive impact on society:

* **Enhanced Road Safety**: With machines adhering strictly to speed limits, stop signs, and traffic lights, the need for traffic enforcement could decrease, potentially saving millions of tax dollars.
* **Reduced Insurance Costs**: The significant decrease in accidents would likely lead to a reduction, if not elimination, of car insurance, further benefiting consumers.
* **Boost to Productivity and Economy**: With the ability to work, relax, or entertain oneself during travel, productivity would increase, potentially boosting the economy.
* **Environmental Benefits**: Efficient parking strategies, such as dropping off passengers and then parking in less convenient spots, would save fuel. Additionally, self-driving cars could optimize routes, further reducing emissions.
* **Increased Accessibility**: Smaller, more efficient vehicles could be used for transporting individuals with disabilities to appointments, replacing larger, less efficient access buses.
* **Logistical Advantages**: Autonomous trucks could operate around the clock without the need for driver rest, potentially lowering the cost of goods by reducing labor and operational costs.

Regarding concerns:

* **Job Elimination vs. Creation**: While certain jobs may be lost, the infrastructure and maintenance of self-driving cars would create new, well-paying positions. Service sector jobs are also abundant and could absorb those displaced.
* **Affordability**: Similar to the historical trend with electronic technology (e.g., phones, TVs), the cost of self-driving cars would likely decrease over time, making them more accessible.
* **Technological Challenges and Liability**:
	+ **Perfection of Technology**: Achieving flawless operation is critical and will require significant time and investment.
	+ **Maintenance of Satellite Infrastructure**: The costs, and the entity responsible, pose significant logistical challenges.
	+ **Liability in Accidents**: Determining fault (manufacturer, infrastructure, or passenger) would require new legal frameworks, but could ultimately lead to a reduction in legal disputes and costs associated with accidents.

While resolving these challenges may take decades, the potential benefits of self-driving cars make them poised to be one of the most transformative phenomena of this century, driven forward by innovative solutions from highly skilled professionals. ","I am in favor of self automative cars and am planning to be in line to buy one once they are implemented. The main advantage of artificial intelligence is it is not biased and cannot be distracted, thereby eliminating accidents,which are always based on human error,according to all statistics. The fact the machine would observe all speed limits,stop signs,traffic lights, would mean the elimination of some traffic cops,saving millloins of tax dollars. In addition to the possible elimination of traffic police, what is exciting is the possible elimination of car insurance, or at least a reduction of it because of many fewer accidents.Productivity would go up which would boost the economy, as instead of concentrating on driving, one could do work in his car(it could be his home office), or even have a martini or watch his favorite television show.Self driving cars would be an advantage for the environment, for instead of a lazy driver aimlessly looking for a parking space closest to the store so they don't have to walk. the self driving car would drop off a person and drive directly to a parking spot maybe  not within walking distance,thereby saving precious fuel. The person would simply have to wait for the car to pick him up! The car could pick up crippled people in smaller more efficient cars to get them to all those dr's appointments, thereby eliminating all those irritating access buses that litter our sreets.Instead of paying a uneducated truck drver, who can be a danger on the highway, a self driving car could drive all night, never needing a paycheck or food. Consequently, the price of our store purchases would go down. As far as the elimination of jobs,there is nothing to be alarmed about as service jobs are very abundant and the infrastructure of the self driving cars would create many well paying positions.The cost of the self driving cars would be prohibitive for some, however, just like Fords model t, the cars would eventually have to be priced so all could afford it.Electronic technology always goes down in price,as is evidenced by phones,tvs,etc. The most daunting task is to actually get the technology to work full proof - it would be critical to this self driving cars to be a perfection with no flaws what so ever. Also, the maintanience of the satellite infrastructure would be quite costly, and what institution would be responsible for the cost.These tasks will take many decades to sort out. In addition to this aspect, if there is an accident, would the manufacturer,infrastructure,or person in the car be at fault.    It would be difficult to sort this out, but once it was done, we could eliminate those pesky ambulance chasing lawyers,asthere still would less accidents. We are decades away from perfection of these issues,however,there are highly cognitive driven people who could figure all this out, so self driving cars will be the biggest phenomenon of this century."
